{
  "kind": "connector",
  "id": "conn.github",
  "name": "GitHub Connector",
  "description": "Read and write GitHub issues and pull requests.",
  "publisher": {
    "name": "Reach Labs",
    "key_id": "reach-prod-1",
    "verified": true
  },
  "versions": [
    {
      "version": "1.3.2",
      "published_at": "2026-02-10T12:00:00Z",
      "sha256": "5f2f94139f4abf40a2b940da29b148a8f9224ed5cb1d0256d9695a6e3cb91ef6",
      "signed": true,
      "signature_key_id": "reach-prod-1"
    }
  ],
  "latest_version": "1.3.2",
  "risk_level": "medium",
  "tier_required": "pro",
  "required_capabilities": ["repo:read", "repo:write"],
  "side_effect_types": ["network", "write"],
  "tags": ["github", "source-control"],
  "categories": ["developer-tools"],
  "docs_url": "https://docs.reach.dev/connectors/github",
  "repo_url": "https://github.com/reach/connectors/github",
  "changelog": "Adds issue-assignee sync and improves retry behavior."
}
